{
  "contract_version": "ansible.execution.v1",
  "request_id": "example-noop-1",
  "runner_id": "noop_v1",
  "provider_id": "trusted_local_v1",
  "parameters": {
    "duration_ms": 0
  },
  "capabilities": [],
  "timeout_seconds": 30,
  "resources": {
    "memory_mb": 256,
    "cpu_seconds": 2
  }
}
